{
  "$schema": "https://json-schema.org/draft/2020-12/schema",
  "$id": "https://ardur.dev/vibap/spec/mission-governance/v0alpha1/decision.schema.json",
  "title": "Governance Decision",
  "description": "A decision represents the governance verdict produced by the reconciler after evaluating observed events against a mission declaration. It includes the overall compliance state, any findings that were generated, the recommended containment action, and metadata about the reconciliation run.",
  "type": "object",
  "additionalProperties": false,
  "required": [
    "session_id",
    "state",
    "recommended_action",
    "events_processed",
    "reconciliation_time"
  ],
  "properties": {
    "session_id": {
      "type": "string",
      "minLength": 1,
      "description": "Identifier of the governance session this decision pertains to. Links the decision back to the session state, declaration, and event stream."
    },
    "state": {
      "type": "string",
      "enum": [
        "compliant",
        "violation",
        "unknown",
        "pending"
      ],
      "description": "Overall compliance state. 'compliant' means all observed behavior matches the declaration. 'violation' means one or more findings indicate policy breaches. 'unknown' means insufficient visibility to make a determination. 'pending' means reconciliation has not yet completed."
    },
    "findings": {
      "type": "array",
      "items": {
        "$ref": "finding.schema.json"
      },
      "description": "Ordered list of findings generated during reconciliation. May be empty when the state is 'compliant' or 'pending'. Each finding details a specific observation about the agent's behavior."
    },
    "recommended_action": {
      "type": "string",
      "enum": [
        "none",
        "log",
        "alert",
        "throttle",
        "quarantine",
        "terminate"
      ],
      "description": "The containment action recommended by the governance engine based on the severity of findings. Escalates from 'none' (no action needed) through 'log' and 'alert' to active containment via 'throttle', 'quarantine', or 'terminate'."
    },
    "events_processed": {
      "type": "integer",
      "minimum": 0,
      "description": "Total number of observed events evaluated during this reconciliation pass. Provides a measure of how much of the event stream has been analyzed."
    },
    "reconciliation_time": {
      "type": "string",
      "format": "date-time",
      "description": "ISO 8601 timestamp of when this reconciliation pass completed. Used for audit trails and to determine decision freshness."
    }
  }
}
