{
  "session_id": "sess-cr-20260310-b2e1",
  "state": "unknown",
  "findings": [
    {
      "code": "INSUFFICIENT_VISIBILITY",
      "event_id": "evt-20260310-004",
      "field": "visibility",
      "message": "Event evt-20260310-004 has partial visibility. The agent accessed config/secrets.yaml but the file content was redacted before reaching the governance pipeline. Cannot determine whether credentials were exposed to the agent.",
      "severity": "warning"
    },
    {
      "code": "SENSITIVE_CONTENT_ACCESS",
      "event_id": "evt-20260310-004",
      "field": "content_class",
      "message": "Agent accessed a resource classified as 'credentials'. While the action class 'read' is permitted, the content sensitivity warrants review given the partial visibility.",
      "severity": "info"
    }
  ],
  "recommended_action": "log",
  "events_processed": 5,
  "reconciliation_time": "2026-03-10T09:10:00Z"
}
